{
  "$schema": "http://json-schema.org/draft-07/schema#",
  "$id": "https://bgq.local/schemas/plan.v1.schema.json",
  "title": "plan",
  "type": "object",
  "required": [
    "v",
    "planId",
    "gameId",
    "problemHash",
    "createdAt",
    "solver",
    "solverMs",
    "t0",
    "stops",
    "finishS",
    "slackMin",
    "totalPoints",
    "expectedPrize",
    "distanceM",
    "dropped"
  ],
  "properties": {
    "v": {
      "type": "number",
      "const": 1
    },
    "planId": {
      "type": "string",
      "pattern": "^[0-9a-f]{8}-[0-9a-f]{4}-[0-9a-f]{4}-[0-9a-f]{4}-[0-9a-f]{12}$"
    },
    "gameId": {
      "type": "string",
      "minLength": 1
    },
    "problemHash": {
      "type": "string",
      "minLength": 1
    },
    "createdAt": {
      "type": "string",
      "pattern": "^\\d{4}-\\d{2}-\\d{2}T\\d{2}:\\d{2}(:\\d{2}(\\.\\d+)?)?(Z|[+-]\\d{2}:\\d{2})$"
    },
    "solver": {
      "enum": [
        "ortools",
        "heuristic"
      ]
    },
    "solverMs": {
      "type": "integer",
      "minimum": 0
    },
    "t0": {
      "type": "string",
      "pattern": "^\\d{4}-\\d{2}-\\d{2}T\\d{2}:\\d{2}(:\\d{2}(\\.\\d+)?)?(Z|[+-]\\d{2}:\\d{2})$"
    },
    "stops": {
      "type": "array",
      "items": {
        "type": "object",
        "required": [
          "kpId",
          "arriveS",
          "departS"
        ],
        "properties": {
          "kpId": {
            "type": "string",
            "pattern": "^(\\d{1,3}[А-ЯЁ]?(#\\d+)?|[a-z][a-z0-9-]*)$"
          },
          "arriveS": {
            "type": "integer",
            "minimum": 0
          },
          "departS": {
            "type": "integer",
            "minimum": 0
          }
        },
        "additionalProperties": false
      }
    },
    "finishS": {
      "type": "integer",
      "minimum": 0
    },
    "slackMin": {
      "type": "number"
    },
    "totalPoints": {
      "type": "number",
      "minimum": 0
    },
    "expectedPrize": {
      "type": "number",
      "minimum": 0
    },
    "distanceM": {
      "type": "integer",
      "minimum": 0
    },
    "dropped": {
      "type": "array",
      "items": {
        "type": "string",
        "pattern": "^(\\d{1,3}[А-ЯЁ]?(#\\d+)?|[a-z][a-z0-9-]*)$"
      }
    }
  },
  "additionalProperties": false
}
